,tweet_id,timestamp,text,rating_numerator,rating_denominator,name,stage,p1,p1_conf,p1_dog,p2,p2_conf,p2_dog,p3,p3_conf,p3_dog,retweet_count,favorite_count
1214,673956914389192708,2015-12-07 20:07:04,This is one esteemed pupper. Just graduated college. 10/10 what a champ https://t.co/nyReCVRiyd,10,10,One,Pupper,Pug,0.5861609999999999,True,Brabancon Griffon,0.0827437,True,Chihuahua,0.0458777,True,1069,2091
1215,673919437611909120,2015-12-07 17:38:09,This is Obie. He is on guard watching for evildoers from the comfort of his pumpkin. Very brave pupper. 11/10 https://t.co/cdwPTsGEAb,11,10,Obie,Pupper,Jack-O'-Lantern,0.172079,False,Schipperke,0.115984,True,Miniature Pinscher,0.052175,True,401,1251
1218,673707060090052608,2015-12-07 03:34:14,This is Raymond. He's absolutely terrified of floating tennis ball. 10/10 it'll be ok pupper https://t.co/QyH1CaY3SM,10,10,Raymond,Pupper,German Short-Haired Pointer,0.935771,True,Kelpie,0.022561,True,Labrador Retriever,0.00884665,True,434,1177
1220,673697980713705472,2015-12-07 02:58:09,This is Pickles. She's a tiny pointy pupper. Average walker. Very skeptical of wet leaf. 8/10 https://t.co/lepRCaGcgw,8,10,Pickles,Pupper,Porcupine,0.151876,False,Hen,0.11138,False,Doormat,0.0589337,False,2165,4067
1225,673656262056419329,2015-12-07 00:12:23,This is Albert AKA King Banana Peel. He's a kind ruler of the kitchen. Very jubilant pupper. 10/10 overall great dog https://t.co/PN8hxgZ9We,10,10,Albert,Pupper,Bull Mastiff,0.700625,True,Rhodesian Ridgeback,0.0946977,True,Brabancon Griffon,0.0575594,True,265,769
1227,673612854080196609,2015-12-06 21:19:54,This is Jeffri. He's a speckled ice pupper. Very lazy. Enjoys the occasional swim. Rather majestic really. 7/10 https://t.co/0iyItbtkr8,7,10,Jeffri,Pupper,Newfoundland,0.223101,True,Leonberg,0.111106,True,Shovel,0.0856263,False,802,1691
1233,673342308415348736,2015-12-06 03:24:51,This is Django. He's a skilled assassin pupper. 10/10 https://t.co/w0YTuiRd1a,10,10,Django,Pupper,Ski Mask,0.981017,False,Chihuahua,0.013559200000000002,True,Kelpie,0.00065218,True,649,1362
1235,673295268553605120,2015-12-06 00:17:55,Meet Eve. She's a raging alcoholic 8/10 (would b 11/10 but pupper alcoholism is a tragic issue that I can't condone) https://t.co/U36HYQIijg,8,10,Eve,Pupper,Golden Retriever,0.889241,True,Labrador Retriever,0.06468330000000001,True,Great Pyrenees,0.0126126,True,3484,8046
1238,673148804208660480,2015-12-05 14:35:56,This is Fletcher. He's had a ruff night. No more Fireball for Fletcher. 8/10 it'll be over soon pupper https://t.co/tA4WpkI2cw,8,10,Fletcher,Pupper,Tub,0.8730100000000001,False,Bathtub,0.0914341,False,Toilet Seat,0.0254563,False,688,1822
1241,672988786805112832,2015-12-05 04:00:04,This is Schnozz. He's had a blurred tail since birth. Hasn't let that stop him. 10/10 inspirational pupper https://t.co/a3zYMcvbXG,10,10,Schnozz,Pupper,Lakeland Terrier,0.8366319999999999,True,West Highland White Terrier,0.07389960000000001,True,Wire-Haired Fox Terrier,0.0381601,True,314,1039
1242,672975131468300288,2015-12-05 03:05:49,This is Chuckles. He is one skeptical pupper. 10/10 stay woke Chuckles https://t.co/ZlcF0TIRW1,10,10,Chuckles,Pupper,Pug,0.8364209999999999,True,Brabancon Griffon,0.044667800000000014,True,French Bulldog,0.0365705,True,1015,1813
1243,672970152493887488,2015-12-05 02:46:02,This is Chet. He's having a hard time. Really struggling. 7/10 hang in there pupper https://t.co/eb4ta0xtnd,7,10,Chet,Pupper,Leaf Beetle,0.340154,False,Rhinoceros Beetle,0.139698,False,Crayfish,0.05803360000000001,False,391,1019
1247,672898206762672129,2015-12-04 22:00:08,This is Cheryl AKA Queen Pupper of the Skies. Experienced fighter pilot. Much skill. True hero. 11/10 https://t.co/i4XJEWwdsp,11,10,Cheryl,Pupper,Motor Scooter,0.8358190000000001,False,Bobsled,0.035856300000000015,False,Moped,0.033079000000000004,False,459,944
1252,672614745925664768,2015-12-04 03:13:46,This is Norman. Doesn't bark much. Very docile pup. Up to date on current events. Overall nifty pupper. 6/10 https://t.co/ntxsR98f3U,6,10,Norman,Pupper,Starfish,0.712717,False,Goldfish,0.258865,False,Sea Cucumber,0.00201543,False,644,1302
1255,672594978741354496,2015-12-04 01:55:13,Meet Scott. Just trying to catch his train to work. Doesn't need everybody staring. 9/10 ignore the haters pupper https://t.co/jyXbZ35MYz,9,10,Scott,Pupper,Great Pyrenees,0.755945,True,Old English Sheepdog,0.0823368,True,Afghan Hound,0.0270366,True,661,1411
1260,672481316919734272,2015-12-03 18:23:34,Say hello to Jazz. She should be on the cover of Vogue. 12/10 gorgeous pupper https://t.co/mVCMemhXAP,12,10,Jazz,Pupper,Border Collie,0.599454,True,Collie,0.106227,True,Shetland Sheepdog,0.0944649,True,137,757
1265,672254177670729728,2015-12-03 03:21:00,This is Rolf. He's having the time of his life. 11/10 good pupper https://t.co/OO6MqEbqG3,11,10,Rolf,Pupper,Pug,0.979487,True,French Bulldog,0.0168504,True,Norwegian Elkhound,0.00161754,True,800,1515
1269,672205392827572224,2015-12-03 00:07:09,This is Opal. He's a Royal John Coctostan. Ready for transport. Basically indestructible. 9/10 good pupper https://t.co/yRBQF9OS7D,9,10,Opal,Pupper,Carton,0.952613,False,Crate,0.0353762,False,Pug,0.00326691,True,1270,2414
1271,672160042234327040,2015-12-02 21:06:56,This is Bubba. He's a Titted Peebles Aorta. Evolutionary masterpiece. Comfortable with his body. 8/10 great pupper https://t.co/aNkkl5nH3W,8,10,Bubba,Pupper,Pug,0.561027,True,French Bulldog,0.222114,True,Labrador Retriever,0.0654556,True,395,918
